question,answer,contexts,ground_truth,context_precision,context_recall,faithfulness,answer_relevancy
Qui est le joueur qui a marqué le plus de points et combien en a-t-il marqué ?,"D'après les données les plus récentes, **Shai Gilgeous-Alexander** est le joueur qui a marqué le plus de points en NBA avec un total de **2 485 points** cette saison.

Un exploit remarquable ! Veux-tu une analyse plus détaillée de ses performances ou une comparaison avec d'autres joueurs ?","[""Dictionnaire des données                                                        Unnamed: 1\n0                    Player                                                     Nom du joueur\n1                      Team                               Équipe du joueur (code à 3 lettres)\n2                       Age                                                     Âge du joueur\n3                        GP                             Nombre de matchs joués (Games Played)\n4                         W             Nombre de victoires de l'équipe lors des matchs joués\n5                         L                                                Nombre de défaites\n6                       Min                                 Minutes moyennes jouées par match\n7                       PTS                               Points marqués en moyenne par match\n8                       FGM                         Tirs réussis par match (Field Goals Made)\n9                       FGA                     Tirs tentés par match (Field Goals Attempted)\n10                      FG%                                  Pourcentage de réussite aux tirs\n11                 15:00:00                                 Minutes jouées après 15:00 de jeu\n12                      3PA                                  Tirs à 3 points tentés par match\n13                      3P%                                Pourcentage de réussite à 3 points""
 '84   Analyse du top 15 des joueurs en nombre de points                      NaN                          NaN                               NaN                                          NaN                                         NaN                NaN                               NaN\n85                                                 NaN                      NaN                          NaN                               NaN                                          NaN                                         NaN                NaN                               NaN\n86                                                 NaN                      NaN                          NaN                               NaN                                          NaN                                         NaN                NaN                               NaN\n87                                             Players    Nombre de point total                          FGM       Pourcentage de tirs réussis  Pourcentage de réussite aux tirs à 3 points  Pourcentage de réussite aux lancers francs  Rebonds offensifs  Estimation de l’impact du joueur\n88                             Shai Gilgeous-Alexander                     2485                          859                              51.9                                         37.5                                        89.8                 68                              19.9'
 '84   Analyse du top 15 des joueurs en nombre de points                      NaN                          NaN                               NaN                                          NaN                                         NaN                NaN                               NaN\n85                                                 NaN                      NaN                          NaN                               NaN                                          NaN                                         NaN                NaN                               NaN\n86                                                 NaN                      NaN                          NaN                               NaN                                          NaN                                         NaN                NaN                               NaN\n87                                             Players    Nombre de point total                          FGM       Pourcentage de tirs réussis  Pourcentage de réussite aux tirs à 3 points  Pourcentage de réussite aux lancers francs  Rebonds offensifs  Estimation de l’impact du joueur\n88                                                 NaN                      NaN                          NaN                               NaN                                          NaN                                         NaN                NaN                               NaN'
 ""27                      TD3            Triple-doubles (≥10 dans trois catégories principales)\n28                    + / -  Plus-Minus (écart de score lorsque le joueur est sur le terrain)\n29                   OFFRTG             Offensive Rating (points marqués par 100 possessions)\n30                   DEFRTG           Defensive Rating (points encaissés par 100 possessions)\n31                   NETRTG                                      Net Rating = OFFRTG - DEFRTG\n32                     AST%     Pourcentage d'assists – implication dans les passes décisives\n33                   AST/TO                                    Ratio passes / pertes de balle\n34                AST RATIO                              Ratio d’assists pour 100 possessions\n35                    OREB%           Pourcentage de rebonds offensifs parmi ceux disponibles\n36                    DREB%                                                  Idem en défensif\n37                     REB%              Pourcentage de rebonds totaux parmi ceux disponibles\n38                 TO RATIO              Turnover Ratio – pertes de balle par 100 possessions\n39                     EFG%                     Effective Field Goal % (pondère les 3 points)\n40                      TS%               True Shooting % (inclut FG et FT dans l'efficacité)\n41                     USG%                Usage Rate – % des actions utilisées par le joueur""
 '41                     USG%                Usage Rate – % des actions utilisées par le joueur\n42                     PACE                        Rythme de jeu (possessions par 48 minutes)\n43                      PIE           Player Impact Estimate – évaluation globale de l’impact\n44                     POSS                                Nombre total de possessions jouées'
 ""Données extraites de la base de données SQL : Données brutes extraites de la base: [('Shai Gilgeous-Alexander', 2485)]""]","Shai Gilgeous-Alexander est le joueur qui a marqué le plus de points lors de la saison régulière, avec un total de 2485 points",0.4166666666458333,1.0,0.5,
Qui est le second meilleur joueur qui a marqué le plus de points et combien en a-t-il marqué ?,"Le second meilleur marqueur de points en NBA cette saison est **Anthony Edwards** avec **2180 points** marqués. Un score impressionnant qui confirme son statut de superstar montante dans la ligue ! 🚀🔥

Tu veux que je compare ses statistiques avec celles du leader (Shai Gilgeous-Alexander) pour voir où il brille le plus ?","[""Dictionnaire des données                                                        Unnamed: 1\n0                    Player                                                     Nom du joueur\n1                      Team                               Équipe du joueur (code à 3 lettres)\n2                       Age                                                     Âge du joueur\n3                        GP                             Nombre de matchs joués (Games Played)\n4                         W             Nombre de victoires de l'équipe lors des matchs joués\n5                         L                                                Nombre de défaites\n6                       Min                                 Minutes moyennes jouées par match\n7                       PTS                               Points marqués en moyenne par match\n8                       FGM                         Tirs réussis par match (Field Goals Made)\n9                       FGA                     Tirs tentés par match (Field Goals Attempted)\n10                      FG%                                  Pourcentage de réussite aux tirs\n11                 15:00:00                                 Minutes jouées après 15:00 de jeu\n12                      3PA                                  Tirs à 3 points tentés par match\n13                      3P%                                Pourcentage de réussite à 3 points""
 '84   Analyse du top 15 des joueurs en nombre de points                      NaN                          NaN                               NaN                                          NaN                                         NaN                NaN                               NaN\n85                                                 NaN                      NaN                          NaN                               NaN                                          NaN                                         NaN                NaN                               NaN\n86                                                 NaN                      NaN                          NaN                               NaN                                          NaN                                         NaN                NaN                               NaN\n87                                             Players    Nombre de point total                          FGM       Pourcentage de tirs réussis  Pourcentage de réussite aux tirs à 3 points  Pourcentage de réussite aux lancers francs  Rebonds offensifs  Estimation de l’impact du joueur\n88                             Shai Gilgeous-Alexander                     2485                          859                              51.9                                         37.5                                        89.8                 68                              19.9'
 '84   Analyse du top 15 des joueurs en nombre de points                      NaN                          NaN                               NaN                                          NaN                                         NaN                NaN                               NaN\n85                                                 NaN                      NaN                          NaN                               NaN                                          NaN                                         NaN                NaN                               NaN\n86                                                 NaN                      NaN                          NaN                               NaN                                          NaN                                         NaN                NaN                               NaN\n87                                             Players    Nombre de point total                          FGM       Pourcentage de tirs réussis  Pourcentage de réussite aux tirs à 3 points  Pourcentage de réussite aux lancers francs  Rebonds offensifs  Estimation de l’impact du joueur\n88                                                 NaN                      NaN                          NaN                               NaN                                          NaN                                         NaN                NaN                               NaN'
 ""27                      TD3            Triple-doubles (≥10 dans trois catégories principales)\n28                    + / -  Plus-Minus (écart de score lorsque le joueur est sur le terrain)\n29                   OFFRTG             Offensive Rating (points marqués par 100 possessions)\n30                   DEFRTG           Defensive Rating (points encaissés par 100 possessions)\n31                   NETRTG                                      Net Rating = OFFRTG - DEFRTG\n32                     AST%     Pourcentage d'assists – implication dans les passes décisives\n33                   AST/TO                                    Ratio passes / pertes de balle\n34                AST RATIO                              Ratio d’assists pour 100 possessions\n35                    OREB%           Pourcentage de rebonds offensifs parmi ceux disponibles\n36                    DREB%                                                  Idem en défensif\n37                     REB%              Pourcentage de rebonds totaux parmi ceux disponibles\n38                 TO RATIO              Turnover Ratio – pertes de balle par 100 possessions\n39                     EFG%                     Effective Field Goal % (pondère les 3 points)\n40                      TS%               True Shooting % (inclut FG et FT dans l'efficacité)\n41                     USG%                Usage Rate – % des actions utilisées par le joueur""
 '41                     USG%                Usage Rate – % des actions utilisées par le joueur\n42                     PACE                        Rythme de jeu (possessions par 48 minutes)\n43                      PIE           Player Impact Estimate – évaluation globale de l’impact\n44                     POSS                                Nombre total de possessions jouées'
 ""Données extraites de la base de données SQL : Données brutes extraites de la base: [('Anthony Edwards', 2180)]""]","Le second meilleur marqueur de la saison régulière est Anthony Edwards, avec un total de 2180 points",0.16666666665,1.0,0.5,
Quelle équipe un commentateur cite-t-il comme ayant été la plus impressionnante à ses yeux ?,"D'après le contexte fourni, plusieurs commentateurs ont partagé leurs avis sur les équipes les plus impressionnantes en playoffs. Cependant, **MannerSuperb AO** a clairement cité les **Pacers** comme l'équipe qui l'a le plus impressionné. Voici sa citation exacte :

> *""For me it's the Pacers. Despite awful shooting, they have really taken the defending champs to the brink. I'm a little biased as a Duke fan but Paolo and Franz are absolute dogs and my favorite young wing duo in the league. Those guys have shown they are built for playoff basketball with their shot making and competing defensively.""*

Il souligne notamment le duo Paolo Banchero et Franz Wagner, ainsi que la résilience de l'équipe face aux difficultés, comme les tirs manquants, pour justifier son choix.","[""4 54\nRépondre\n22 réponses\nsupplémentaires\nPeachTreeDish91\nYou really seem like the type of dude who spends 10 minutes watching the youtube highlights\nwhile checking the box score; then spends the next 60 minutes typing bs out the ass on reddit\n0\nRépondre\n[TallnFrosty\nuntil\nfixes his shooting,\ndon't think 'dynamic' is the right word for him\nRépondre\n2 réponses\nsupplémentaires\nlegendofthededbug\nthepeachgod\nIndiana is gonna have a better chance at beating Cleveland than people will give them\nhttps:/lwww reddit.comlrInbalcomments/1k9wrcj/who_are_teams\nin_the\nplayoffs_that_have_impressedl\n8/15\nwing\nguard\nthey'\nfranz\n12/06/2025 13.06\nWho are teams in the\nplayoffs that have impressed you ?\nrInba\nAccéder au contenu principal\nSe connecter\nComm. du top 1%\nSiakam is the most underrated player in the league as far as impact towards winning. If that team's\nclicking; which they seem to be with Hali dishing the way he is right now; they' re a tough out for\nanyone\n10\nRépondre\nshhhhhhhwish\nBy far the toughest series last year for the Celtics.\nthink we'll get a Celtics Indy rematch tbh.. no one\nwill see it coming but it wasn't a fluke Indy\nthere last year\n0 -1\nRépondre\nYankeeknickfan\n-1 m\nIt's impressive that they're finally not just scraping by a team that's injured and straight up\nDominating\na worse team.\nDefinitely better than last year\nBut the bucks are awful. Really don't get why dominating them says anything about Cleveland\nRépondre\nProvocativeHotTakes\nm.\nCommon-Bad-7899""
 ""scoring: Warriors have a great offense and struggling against a physical rockets defense\n-16\nRépondre\njunkit33\nComm. du\n1%\nThe Magic offense is basketball terrorism.\nRépondre\nNotManyBuses\n-1 m\nComm. du top 1%\nThe Magic and Rockets are football teams effectively just roughing up their superior opponents\nand injuring them. In fact the only reason either team won a game is\nto taking out the elite\nplayers on Boston/GS.\nam not impressed in the slightest. It's bush league stuff due to a complete lack of skill on both\nrosters\n38\nRépondre\nmoby323\nFm.\nAuteur-rice\n1%\nThat's going a little overboard\n23\nRépondre\nNotManyBuses\n-1 m\nComm. du top 1%\nAm\nwrong though\nRépondre\nréponses supplémentaires\nMannerSuperb AO\n-Lm.\nhttps:/lwww reddit.comlrInbalcomments/1k9wrcj/who_are\nteams\nin_the_playoffs_that_have_impressedl\n6/15\nthey\nbeing\ntop\ndue\ntop\n12/06/2025 13.06\nWho are teams in the\nplayoffs that have impressed you ?\nrInba\nAccéder au contenu principal\nSe connecter\n2 réponses supplémentaires\nfrankievejle\nBla bla bla the narrative that the Warriors aren't also playing extremely physical basketball is\ncrazy.\nWarriors fans have done a masterful job of complaining so much and so loudly that you have\npeople out here legit thinking the physicality is just one sided while they're playing some\npristine brand of basketball.\nRépondre\nNotManyBuses\nm.\nComm. du top 1%\nare; the difference is\nhave Steph.\nYou have Van Vleet.\n4 1\nRépondre\nréponse supplémentaire\nMannerSuperb AO\n-1m.""
 ""But the bucks are awful. Really don't get why dominating them says anything about Cleveland\nRépondre\nProvocativeHotTakes\nm.\nCommon-Bad-7899\nPistons are one shot creator from\nan ECF\ncontending team imo.\n51\nRépondre\nMannerSuperb AO\nm:\nthink jaden Ivey has potential to be the missing piece for them\nHe was\nstarting to elevate his game\nbefore his injury\n25\nRépondre\naenima1991\n' -1m.\n100009\nthinking that\nwhere would\nbe w Ivey. Probably up in this series\n4 7\nRépondre\nOther-Owl4441\nLove Ivey but isn't the ideal profile for that missing piece a shot creator who's a knockdown\nshooter, instead?\nRépondre\nPootieTooGood\nComm. du\n1%\nIm praying that they do not believe Ty Jerome is their answer since\n're the team with the cap\nspace to pry him away from us\nRépondre\nhttps:/lwww reddit.comlrInbalcomments/1k9wrcj/who_are\nteams\nin_the\nplayoffs_that_have_impressedl\n9/15\ngot\nbeing\nkeep\nthey\ntop\nthey'\n12/06/2025 13.06\nWho are teams in the\nplayoffs that have impressed you ?\nrInba\nAccéder au contenu principal\nSe connecter\nshort still\n0\nRépondre\ninshamblesx\nComm. du\n1%\nwolves by a mile\nU\n29\nRépondre\nTemperedTorture\nComm. du top\nWolves by far. Particularly Edwards.\nhadn't seen any Wolves games going into the playoffs, so\nhad no\nclue just how amazing Edwards was and he's really in the middle of a massive leap these playoffs. They\nhave a strong team\nand that's important these playoffs more than ever. Hero/iso ball is essentially dead\nbecause of how\ndefences have gotten""
 ""Répondre\nhttps:/lwww reddit.comlrInbalcomments/1k9wrcj/who_are\nteams\nin_the_playoffs_that_have_impressedl\n4/15\nget\ntop\ntop\nthey\nthey\nbeing\nthey\nthey\nthey\n12/06/2025 13.06\nWho are teams in the\nplayoffs that have impressed you ?\nrInba\nAccéder au contenu principal\nSe connecter\nLl\nYPPy\nuyiiiy\n11[\nVi cui\n[\nJui\nC\nVl\nquick precision platformer!\nTélécharger\nstore steampowered com\nJamstarr2024\nCade. Dude needs to seriously cut down on the turnovers, but he's a bucket.\n79\nRépondre\nRelevant_Gold4912\n1m\nComm. du\n19\nget frustrated with his sloppy turnovers a lot but he needs just one more guy who can score or\ncreate their own shots for themselves or others. Hopefully it's Ivey. Cade is sloppy with the ball and\nforces a lot of bad turnovers but he's kind of in the position he has to. Too many possessions where\nwe can't even\nthe ball inside 30 feet of the basket if he doesn't touch the ball\n4\n13\nRépondre\nremonnoki\n-1m.\nCade has really impressed with his play but even more so with his leadership.\nthink Detroid has a\nmaturity and emotion problem which can be buffed out with age and experience: He's holding both\nhimself and his teammates accountable. Him pushing his rookie away yesterday to keep him in check,\nchill him out and stop him from getting a stupid tech was some real shit.\n0\nRépondre\nRelevant_Gold4912\n-1m\nComm. du top 1%\ndon't think that's really the issue: It's a talent issue. Stew\nHolland definitely run hot but that's\nnot the issue. The team feeds off that a lot of""
 '12/06/2025 13.06\nWho are teams in the\nplayoffs that have impressed you ?\nrInba\nAccéder au contenu principal\nRechercher dans r/nba\nYA\nSe connecter\nrInba\nil y a 1 m\nMannerSuperb\nWho are teams in the playoffs that have impressed you ?\nFor me it\'s the\nDespite awful shooting\nhave really taken the defending champs to the brink. Im a\nlittle biased as a Duke fan but Paolo and Franz are absolute dogs and my favorite young wing duo in the\nleague those guys have shown\nare built for playoff basketball with their shot making\nand\ncompeting defensively.\ntruly hope orl can get those kids some real shooters and a true point\ntheirs\nanother level their games and overall team can reach if\nsimply had some floor spacing and average\nplay around them.\n31\n236\nPartager\nxometry_europe\nSponsorisé(e)\n""Si seulement je l\'avais su plus tôt"" , disent souvent les ingénieurs et dessinateurs après\nAccélérez le\navoir découvert les possibilités de prototypage offertes par Xometry . Face aux méthodes\ndéveloppement de vos\nprototypes avec Xometry\ntraditionnelles; la plateforme Xometry apporte rapidité et flexibilité.\noplimsez Vos orgessuS\nfegiuie]\neos\noC Sui\nMarchle Yraccahuoricatior 4\naetande\nEn savoir plus\npages xometry eu\nXometry\nRejoindre la conversation\nTrier par\nMeilleurs\nRechercher des commentaires\nNotWD . -1\nAnt\'s been a machine as expected; but Randle\'s genuinely beating the beyblade allegations and it\'s so\nnice to see\n186\nRépondre\nMG MN\nComm. du\n1%']",Indiana Pacers et Minnesota Timberwolves.,0.0,0.0,1.0,
MOYENNE GLOBALE,---,---,---,0.19444444443194442,0.6666666666666666,0.6666666666666666,
